{
  "schema": "stcli.fixture-suite/v2",
  "profile": "sillytavern-1.18-core",
  "cases": [
    {
      "kind": "macro-render",
      "id": "macro.unknown.preserve-literal",
      "name": "unknown macro is preserved",
      "input": "before {{platformMacro::x}} after",
      "context": {},
      "initial_local": {},
      "initial_global": {},
      "expected_text": "before {{platformMacro::x}} after",
      "expected_local": {},
      "expected_global": {},
      "expected_warnings": 1
    }
  ],
  "macro_groups": [
    {
      "defaults": {
        "context": {
          "char": "Alice"
        },
        "initial_local": {
          "Alice_mood": "happy"
        },
        "initial_global": {},
        "expected_warnings": 0
      },
      "cases": [
        {
          "id": "macro.char.plain",
          "input": "{{char}}",
          "expected_text": "Alice",
          "expected_local": {
            "Alice_mood": "happy"
          }
        },
        {
          "id": "macro.char.nested-lookup",
          "input": "{{getvar::{{char}}_mood}}",
          "expected_text": "happy",
          "expected_local": {
            "Alice_mood": "happy"
          }
        },
        {
          "id": "macro.getvar.nested-brace",
          "input": "{{getvar::{{char}}_mood}}",
          "expected_text": "happy",
          "expected_local": {
            "Alice_mood": "happy"
          }
        }
      ]
    },
    {
      "defaults": {
        "context": {},
        "initial_local": {},
        "initial_global": {},
        "expected_warnings": 0
      },
      "cases": [
        {
          "id": "macro.if.discard-no-side-effects",
          "input": "{{if::false}}{{setvar::bad::1}}{{else}}{{setvar::good::2}}ok{{/if}}",
          "expected_text": "ok",
          "expected_local": {
            "good": "2"
          }
        },
        {
          "id": "macro.setvar.shorthand-add",
          "input": "{{.score = 1}}{{.score += 2}}{{.score}}",
          "expected_text": "3",
          "expected_local": {
            "score": "3"
          }
        },
        {
          "id": "macro.setglobalvar.global-scope",
          "input": "{{setglobalvar::weather::rain}}{{getglobalvar::weather}}",
          "expected_text": "rain",
          "expected_global": {
            "weather": "rain"
          }
        },
        {
          "id": "macro.setvar.utf8-args",
          "input": "{{setvar::greeting::\u65e5\u672c\ud83d\ude42}}{{getvar::greeting}}",
          "expected_text": "\u65e5\u672c\ud83d\ude42",
          "expected_local": {
            "greeting": "\u65e5\u672c\ud83d\ude42"
          }
        },
        {
          "id": "macro.newline.plain",
          "input": "a{{newline}}b",
          "expected_text": "a\nb"
        },
        {
          "id": "macro.space.plain",
          "input": "a{{space}}b",
          "expected_text": "a b"
        },
        {
          "id": "macro.noop.plain",
          "input": "a{{noop}}b",
          "expected_text": "ab"
        },
        {
          "id": "macro.//.plain",
          "input": "a{{// hidden}}b",
          "expected_text": "ab"
        },
        {
          "id": "macro.trim.plain",
          "input": "{{trim::  hello  }}",
          "expected_text": "hello"
        },
        {
          "id": "macro.reverse.plain",
          "input": "{{reverse::abc}}",
          "expected_text": "cba"
        }
      ]
    },
    {
      "defaults": {
        "context": {},
        "initial_local": {},
        "initial_global": {},
        "expected_warnings": 0
      },
      "cases": [
        {
          "id": "macro.addvar.positive",
          "input": "{{setvar::score::10}}{{addvar::score::5}}{{getvar::score}}",
          "expected_text": "15",
          "expected_local": {
            "score": "15"
          }
        },
        {
          "id": "macro.addvar.boundary-nonnumeric",
          "input": "{{setvar::name::Alice}}{{addvar::name::5}}{{getvar::name}}",
          "expected_text": "Alice5",
          "expected_local": {
            "name": "Alice5"
          }
        },
        {
          "id": "macro.addvar.boundary-missing",
          "input": "{{addvar::missing::5}}",
          "expected_text": "{{addvar::missing::5}}",
          "expected_local": {},
          "expected_warnings": 1
        },
        {
          "id": "macro.addglobalvar.positive",
          "input": "{{setglobalvar::gp::10}}{{addglobalvar::gp::5}}{{getglobalvar::gp}}",
          "expected_text": "15",
          "expected_global": {
            "gp": "15"
          }
        },
        {
          "id": "macro.addglobalvar.boundary-missing",
          "input": "{{addglobalvar::fresh::7}}{{getglobalvar::fresh}}",
          "expected_text": "7",
          "expected_global": {
            "fresh": "7"
          }
        },
        {
          "id": "macro.incvar.positive",
          "input": "{{setvar::counter::5}}{{incvar::counter}}",
          "expected_text": "6",
          "expected_local": {
            "counter": "6"
          }
        },
        {
          "id": "macro.incvar.boundary-missing",
          "input": "{{incvar::fresh}}",
          "expected_text": "1",
          "expected_local": {
            "fresh": "1"
          }
        },
        {
          "id": "macro.decvar.positive",
          "input": "{{setvar::counter::5}}{{decvar::counter}}",
          "expected_text": "4",
          "expected_local": {
            "counter": "4"
          }
        },
        {
          "id": "macro.decvar.boundary-zero",
          "input": "{{setvar::counter::0}}{{decvar::counter}}",
          "expected_text": "-1",
          "expected_local": {
            "counter": "-1"
          }
        },
        {
          "id": "macro.incglobalvar.positive",
          "input": "{{setglobalvar::gc::5}}{{incglobalvar::gc}}",
          "expected_text": "6",
          "expected_global": {
            "gc": "6"
          }
        },
        {
          "id": "macro.decglobalvar.positive",
          "input": "{{setglobalvar::gc::5}}{{decglobalvar::gc}}",
          "expected_text": "4",
          "expected_global": {
            "gc": "4"
          }
        },
        {
          "id": "macro.incglobalvar.boundary-missing",
          "input": "{{incglobalvar::fresh}}",
          "expected_text": "1",
          "expected_global": {
            "fresh": "1"
          }
        },
        {
          "id": "macro.decglobalvar.boundary-missing",
          "input": "{{decglobalvar::fresh}}",
          "expected_text": "-1",
          "expected_global": {
            "fresh": "-1"
          }
        },
        {
          "id": "macro.deletevar.boundary-missing",
          "input": "{{deletevar::nonexistent}}",
          "expected_text": ""
        },
        {
          "id": "macro.deleteglobalvar.boundary-missing",
          "input": "{{deleteglobalvar::nonexistent}}",
          "expected_text": ""
        },
        {
          "id": "macro.getvar.boundary-missing",
          "input": "{{getvar::nonexistent}}",
          "expected_text": ""
        },
        {
          "id": "macro.deletevar.positive",
          "input": "{{setvar::trash::x}}{{deletevar::trash}}{{hasvar::trash}}",
          "expected_text": "false",
          "expected_local": {}
        },
        {
          "id": "macro.deleteglobalvar.positive",
          "input": "{{setglobalvar::gtrash::x}}{{deleteglobalvar::gtrash}}{{hasglobalvar::gtrash}}",
          "expected_text": "false",
          "expected_global": {}
        },
        {
          "id": "macro.hasvar.positive",
          "input": "{{setvar::seen::1}}{{hasvar::seen}}",
          "expected_text": "true",
          "expected_local": {
            "seen": "1"
          }
        },
        {
          "id": "macro.hasvar.boundary-missing",
          "input": "{{hasvar::unseen}}",
          "expected_text": "false",
          "expected_local": {}
        },
        {
          "id": "macro.hasglobalvar.positive",
          "input": "{{setglobalvar::g::1}}{{hasglobalvar::g}}",
          "expected_text": "true",
          "expected_global": {
            "g": "1"
          }
        },
        {
          "id": "macro.hasglobalvar.boundary-missing",
          "input": "{{hasglobalvar::g}}",
          "expected_text": "false",
          "expected_global": {}
        },
        {
          "id": "macro.getglobalvar.positive",
          "input": "{{setglobalvar::city::Tokyo}}{{getglobalvar::city}}",
          "expected_text": "Tokyo",
          "expected_global": {
            "city": "Tokyo"
          }
        },
        {
          "id": "macro.getglobalvar.boundary-missing",
          "input": "{{getglobalvar::missing}}",
          "expected_text": "{{getglobalvar::missing}}",
          "expected_global": {},
          "expected_warnings": 1
        },
        {
          "id": "macro.else.fallback-when-false",
          "input": "{{if::false}}yes{{else}}no{{/if}}",
          "expected_text": "no",
          "expected_local": {}
        },
        {
          "id": "macro.if.nested-ordering",
          "input": "{{if::true}}outer{{if::false}}inner{{else}}alt{{/if}}{{/if}}",
          "expected_text": "outeralt",
          "expected_local": {}
        }
      ]
    },
    {
      "defaults": {
        "context": {
          "char": "Alice",
          "user": "Bob",
          "description": "A brave knight",
          "personality": "bold",
          "scenario": "the tavern",
          "persona": "Wanderer",
          "group": "Party",
          "groupnotmuted": "true",
          "summary": "They met at the tavern.",
          "short_term_memory": "recent events",
          "long_term_memory": "past events",
          "mesexamplesraw": "Example raw",
          "mesexamples": "Example",
          "chardepthprompt": "depth prompt",
          "charcreatornotes": "creator notes",
          "charfirstmessage": "Hello there!",
          "charversion": "1.0",